{"assessment_mode":"offline","binary_observability":[{"bytes_observable":false,"class":"images","count":1,"exact_verification_capable":false,"filename_observable":true,"mime_observable":false,"relation_observable":true,"sha256_observable":false,"size_observable":false},{"bytes_observable":false,"class":"technical_sheets","count":1,"exact_verification_capable":false,"filename_observable":true,"mime_observable":true,"relation_observable":false,"sha256_observable":false,"size_observable":true}],"blockers":[],"checks":[],"contract_fingerprint":"cccccccccccccccccccccccccccccccccccccccccccccccccccccccccccccccc","counts":{"blockers":0,"collections_present":7,"collections_required":7,"resources_observed":7,"warnings":1},"dto_compatibility":[],"mutation_authorized":false,"next_permitted_step":"manual_binary_verification","relation_checks":[],"report_fingerprint":"aaaaaaaaaaaaaaaaaaaaaaaaaaaaaaaaaaaaaaaaaaaaaaaaaaaaaaaaaaaaaaaa","result":"read_compatible_manual_binary_verification","root_category":{"count":1,"identity":"maquinaria","positive_integer_id":true,"unique":true,"valid":true},"rules_version":"jem-local-readiness-v2","schema_version":"1.0.0","snapshot_capture_mode":"local_get_read_only","snapshot_fingerprint":"bbbbbbbbbbbbbbbbbbbbbbbbbbbbbbbbbbbbbbbbbbbbbbbbbbbbbbbbbbbbbbbb","source_mode":"local_get_snapshot","warnings":[{"code":"BINARY_CONTENT_NOT_OBSERVABLE"}],"zero_mutation_manifest":{"assessment_network_requests":0,"content_published":false,"mutation_authorized":false,"mutation_requests":0,"resources_created":0,"resources_deleted":0,"resources_updated":0}}
